id,FullAskText, Бабчинський Олександр Васильович, Бенкендорф Геннадій Данилович, Васильянов Дмитро Сергійович, Гаврилюк Василь Васильович, Гамалій Андрій Вячеславович, Гордійчук Валерій Григорович, Гурома Анатолій Степанович, Дюднєв Андрій Михайлович, Дюднєв Артем Михайлович, Жильчук Олександр Борисович, Кобильник Василь Володимирович, Конюшенко Андрій Олександрович, Костинюк Володимир Володимирович, Костюкович Дмитро Карлович, Мастикаш Андрій Ігорович, Микуляк Іван Михайлович, Наглюк Юлія Вікторівна, Невенчан Геннадій Володимирович, Пливанюк Юрій Васильович, Посітко Михайло Володимирович, Розбам Микола Нюсевич, Савчук Наталія Федорівна, Сімашкевич Михайло Євстафійович, Слободян Валерій Анатолійович, Старченко Світлана Володимирівна, Ткач Олег Васильович, Ткачук Олександр Анатолійович, Цвігун Борис Ярославович, Чинчик Олександр Сергійович, Чистяков Анатолій Євгенович, Яриновський Юрій Леонідович,result
1,"Про звернення до Президента України, Голови Верховної Ради України та Прем’єр-міністра України щодо скасування рішення НКРЕКП з встановлення розміру абонентської плати за підключення до системи газопостачання.", ЗА, ЗА, ЗА, ЗА, ЗА, ЗА, ЗА, ЗА, ЗА, ЗА, ЗА, ЗА, ЗА, ЗА, ЗА, ЗА, ЗА, ЗА, НЕ ГОЛОСУВАВ, ЗА, ЗА, ЗА, ЗА, ЗА, ЗА, ЗА, ЗА, ЗА, ЗА, ЗА, ЗА,РІШЕННЯ ПРИЙНЯТО
2,"Про звернення до Президента України, Голови Верховної Ради України та Прем’єр-міністра України щодо скасування рішення НКРЕКП з встановлення розміру абонентської плати за підключення до системи газопостачання.", ЗА, ЗА, ЗА, ЗА, ЗА, ЗА, ЗА, ЗА, ЗА, ЗА, ЗА, ЗА, ЗА, ЗА, ЗА, ЗА, ЗА, ЗА, ЗА, ЗА, ЗА, ЗА, ЗА, ЗА, ЗА, ЗА, ЗА, ЗА, ЗА, ЗА, ЗА,РІШЕННЯ ПРИЙНЯТО
3,"Про внесення змін та доповнень до рішення 24 (позачергової) сесії міської ради від 23.12.2016 № 3/24 «Про міський бюджет на 2017 рік» та додатків до нього, з врахуванням змін та доповнень, внесених рішенням 25 сесії міської ради від 31.01.2017 № 12/25, рішенням 26 (позачергової) сесії міської ради від 14.02.2017 № 5/26, рішенням 29 (позачергової) сесії міської ради від 15.03.2017 № 1/29, рішенням 30 сесії міської ради від 28.03.2017 № 101/30.", ЗА, ЗА, ЗА, ЗА, ЗА, ЗА, ЗА, ЗА, ЗА, ЗА, ЗА, ЗА, ЗА, ЗА, ЗА, ЗА, ЗА, ЗА, ЗА, ЗА, ЗА, ЗА, ЗА, ЗА, ЗА, ЗА, ЗА, ЗА, ЗА, ЗА, ЗА,РІШЕННЯ ПРИЙНЯТО
4,"Про заміну сторони у зобов’язанні до договору оренди землі від четвертого листопада 2008 року, укладеного між Кам’янець-Подільською міською радою та Публічним акціонерним товариством “Волиньбакалія” за адресою вулиця Хмельницьке шосе - вулиця Руслана Коношенка (стара назва - вулиця Пархоменка) - проспект Грушевського.", ЗА, ЗА, ЗА, ЗА, ЗА, ЗА, ЗА, ЗА, ЗА, ЗА, ЗА, ЗА, ЗА, ЗА, ЗА, ЗА, ЗА, ЗА, ЗА, ЗА, ЗА, ЗА, ЗА, ЗА, ЗА, ЗА, ЗА, ЗА, ЗА, ЗА, ЗА,РІШЕННЯ ПРИЙНЯТО
5,Повторний розгляд рішення міської ради від 28 березня 2017 року № 45/30 «Про надання дозволу на розроблення проекту землеустрою щодо відведення земельної ділянки за адресою вулиця Хмельницьке шосе (біля будинку № 19) Дунчику Ю.В.»., ПРОТИ, ПРОТИ, ПРОТИ, ПРОТИ, ПРОТИ, ПРОТИ, ПРОТИ, НЕ ГОЛОСУВАВ, ПРОТИ, ПРОТИ, ПРОТИ, ПРОТИ, ПРОТИ, ПРОТИ, ПРОТИ, ПРОТИ, ПРОТИ, ПРОТИ, ПРОТИ, ПРОТИ, ПРОТИ, ПРОТИ, ПРОТИ, ПРОТИ, ПРОТИ, ПРОТИ, ПРОТИ, ПРОТИ, ПРОТИ, ПРОТИ, ПРОТИ,РІШЕННЯ НЕ ПРИЙНЯТО
